{
  "name": "ble-sensor-app",
  "one_liner": "Flutter app that reads BLE heart-rate sensors and syncs offline-first to Firebase.",
  "status": "abandoned",
  "languages": ["dart"],
  "stack": ["flutter", "dart", "riverpod", "firebase_core", "drift"],
  "entry_points": ["lib/main.dart", "lib/core/ble/scanner.dart"],
  "ideas": [
    {
      "name": "Offline-first sync queue with conflict resolution",
      "where": "lib/sync/queue.dart:12-210"
    },
    {
      "name": "BLE reconnect with exponential backoff",
      "where": "lib/core/ble/reconnect.dart:1-95"
    }
  ],
  "reusable_modules": ["lib/sync", "lib/core/ble"],
  "gotchas": [
    "iOS background BLE requires bluetooth-central capability in Info.plist",
    "Firebase security rules in the staging project were left unfinished"
  ],
  "commands": ["flutter pub get", "flutter test"],
  "why_stopped": "Lost interest after sensor vendor changed protocol",
  "last_commit_date": "2023-04-11",
  "source_fingerprint": "a1b2c3d4e5f60718293a4b5c6d7e8f90a1b2c3d4e5f60718293a4b5c6d7e8f90",
  "git_commit": "9f3c2ab",
  "generated_by": "deterministic"
}
