{
  "name": "chat_server",
  "one_liner": "Async TCP/WebSocket chat server in Rust with room broadcast channels and token auth.",
  "status": "finished",
  "languages": ["rust"],
  "stack": ["rust", "tokio", "axum", "serde"],
  "entry_points": ["src/main.rs", "src/hub.rs"],
  "ideas": [
    {
      "name": "Bounded fan-out room hub using tokio::sync::broadcast with slow-consumer eviction",
      "where": "src/hub.rs:18-142"
    }
  ],
  "reusable_modules": ["src/hub.rs", "src/auth.rs"],
  "gotchas": ["Lagged receivers receive RecvError::Lagged and reconnect from last sequence id"],
  "commands": ["cargo test --workspace"],
  "last_commit_date": "2025-11-03",
  "source_fingerprint": "b2c3d4e5f60718293a4b5c6d7e8f90a1b2c3d4e5f60718293a4b5c6d7e8f9012",
  "git_commit": "4e81c90",
  "generated_by": "deterministic"
}
