{
  "name": "localchat_app",
  "one_liner": "Kotlin Android client for LAN peer discovery and offline messaging over mDNS.",
  "status": "abandoned",
  "languages": ["kotlin"],
  "stack": ["kotlin", "android", "gradle"],
  "entry_points": ["app/src/main/java/com/example/localchat/MainActivity.kt"],
  "ideas": [
    {
      "name": "NsdManager mDNS service discovery wrapper with lifecycle-aware coroutine flow",
      "where": "app/src/main/java/com/example/localchat/net/MdnsDiscovery.kt:15-130"
    }
  ],
  "reusable_modules": ["app/src/main/java/com/example/localchat/net"],
  "gotchas": ["Android 13+ requires NEARBY_WIFI_DEVICES runtime permission"],
  "commands": ["./gradlew testDebugUnitTest"],
  "last_commit_date": "2024-06-01",
  "source_fingerprint": "e5f60718293a4b5c6d7e8f90a1b2c3d4e5f60718293a4b5c6d7e8f9012345678",
  "git_commit": "8812dfe",
  "generated_by": "deterministic"
}
